{"battery":{"id":"toolchain","revision":1,"sha256":"acd16d43554595d0df497853ebf3d086da6f7e0b8d0a1d6336bc8adcd4c10e4a","source_sha256":"e3e25b59b87cfe048e0f28443854e554aa6d83e6d39553fff08b0d6904d4c1e6"},"campaign_id":"4fdfa915f8ff6ec20b688ac3b298e5cf","fairness":{"direct_arms_tools_disabled":true,"gemma_info_stage":"before-tool-1","live_network_used":false,"local_sources_content_addressed":true,"same_binding_identity":true,"same_sampling":true,"same_seed":true,"tool_results_never_prefed":true},"items":[{"case_sha256":"5e59e4c7bd51aa99a6ddcf926cb557b33e5957ab5f271b3a820fec046e55b74f","core_origin":{"binding_sha256":"e9fe86e9e4bfe6647e9cfc83b489be6ceb168789673f818f9c3576c5633ed0fa","context_mode":"substrate","dimensions":{"causal_order":true,"final_accuracy":true,"no_parasitic_calls":true,"result_integration":true,"tool_1_selection":true,"tool_2_selection":true},"passed":true,"reason_code":null,"response_sha256":"03ee37ff30df893e5aac03388ce78feb0838be6beb2332d3d58cae047cbd1ebe","response_text":"{\"target\":\"TARGET-31BD55DE0B1E\"}","sampling_sha256":"6815d5c5f3a65be2af89ab34f4ea72213b9f765bc4a11615516c84d3a2205990","status":"completed","subject_id":"core-origin","tool_trace":[{"arguments":{"limit":8,"path":"toolchain/tc-list-read-01","pattern":"*.txt","recursive":false,"root_id":"workspace"},"arguments_sha256":"b6626fd91cf38ca30c23b42485eca715c3262bf1bd0e1ae2789c80938f4f15f7","ordinal":1,"outcome":"completed","reason_code":null,"result_sha256":"473a3f96ce1005c5e1c00464a118947591f9d71b63e3727b00733d9a42928c08","target_line_attested":false,"tool_id":"list_files"},{"arguments":{"max_characters":4096,"offset":0,"path":"toolchain/tc-list-read-01/active--read_workspace_file--SEL-16BE981C2C75.txt"},"arguments_sha256":"d549347fd9385902f30c7eee55bfc29e497e066deeefbbfe376e431e6b86b407","ordinal":2,"outcome":"completed","reason_code":null,"result_sha256":"903f606c399b258e84de0bd28ade567210dd54c0a7091881dd38b8bdcf1d442c","target_line_attested":true,"tool_id":"read_workspace_file"}],"tools_declared":true},"evidence":{"case_result":{"identifier":"case-result","relative_path":"cases/tc-list-read-01/evidence/case-result.json","schema_id":"elyne.eval.toolchain-case-result/v1","sha256":"21e6cfc4bc5542ecb3674f7963a1f3a6759deab51e5905d5b2eb4c7bcd80884f","size_bytes":674},"planted_sources":{"identifier":"planted-sources","relative_path":"cases/tc-list-read-01/evidence/planted-sources.json","schema_id":"elyne.eval.toolchain-planted-sources/v1","sha256":"edcb2f4d0ac71f55f92a4d7c3057b6ead80a50fcd8223d0b43af57cae6553b65","size_bytes":1144},"replayed_material":{"identifier":"replayed-material","relative_path":"cases/tc-list-read-01/evidence/replayed-material.json","schema_id":"elyne.eval.toolchain-replayed-material/v1","sha256":"a591121bbdcf62aba949420f06784e6c28aafc3c1de1f5b9a2a6aaa4a7ee07c9","size_bytes":414},"tool_trace":{"identifier":"tool-trace","relative_path":"cases/tc-list-read-01/evidence/tool-trace.json","schema_id":"elyne.eval.toolchain-tool-trace/v1","sha256":"48de185bc984ab748c51ece985830aba1118d214bc3d0dd36c480831c9b2d04a","size_bytes":1009}},"gemma_info":{"binding_sha256":"e9fe86e9e4bfe6647e9cfc83b489be6ceb168789673f818f9c3576c5633ed0fa","context_mode":"initial-information-only","dimensions":{"causal_order":false,"final_accuracy":false,"no_parasitic_calls":false,"result_integration":false,"tool_1_selection":false,"tool_2_selection":false},"passed":false,"reason_code":null,"response_sha256":"9511a2b3fc44d0ea872d63522472d34734b8ec4cf3f13fd02f859bf0ddf79db7","response_text":"{\"target\": \"toolchain/tc-list-read-01/active--read_workspace_file--config.txt\"}","sampling_sha256":"6815d5c5f3a65be2af89ab34f4ea72213b9f765bc4a11615516c84d3a2205990","status":"completed","subject_id":"gemma-info","tool_trace":[],"tools_declared":false},"gemma_nu":{"binding_sha256":"e9fe86e9e4bfe6647e9cfc83b489be6ceb168789673f818f9c3576c5633ed0fa","context_mode":"user-only","dimensions":{"causal_order":false,"final_accuracy":false,"no_parasitic_calls":false,"result_integration":false,"tool_1_selection":false,"tool_2_selection":false},"passed":false,"reason_code":null,"response_sha256":"d189a47807c5cc0436dc88a5c3b8883f0144b16548aaeaeea5579fb3a30e01df","response_text":"I cannot perform the requested actions because I do not have access to any tools or endpoints in my current context. Therefore, I cannot execute the chain of acquisitions or retrieve any data from a workspace.","sampling_sha256":"6815d5c5f3a65be2af89ab34f4ea72213b9f765bc4a11615516c84d3a2205990","status":"completed","subject_id":"gemma-nu","tool_trace":[],"tools_declared":false},"id":"tc-list-read-01","pattern":"list-read"},{"case_sha256":"d250a0c27e216f402a84f203af59b7d91f91e2b0ae05eee3f26c1c21a8372df3","core_origin":{"binding_sha256":"e9fe86e9e4bfe6647e9cfc83b489be6ceb168789673f818f9c3576c5633ed0fa","context_mode":"substrate","dimensions":{"causal_order":true,"final_accuracy":true,"no_parasitic_calls":true,"result_integration":true,"tool_1_selection":true,"tool_2_selection":true},"passed":true,"reason_code":null,"response_sha256":"996ea85bb96878114a94ed7d99968de74998bfface55b1bb40e88ee5f631f018","response_text":"{\"target\":\"TARGET-F5359059BFB7\"}","sampling_sha256":"6815d5c5f3a65be2af89ab34f4ea72213b9f765bc4a11615516c84d3a2205990","status":"completed","subject_id":"core-origin","tool_trace":[{"arguments":{"limit":8,"path":"toolchain/tc-list-read-02","pattern":"*.txt","recursive":false,"root_id":"workspace"},"arguments_sha256":"381c7f33ead5c711ca51f5afef3380d9826c455a46f827e0c66ec6b331383dac","ordinal":1,"outcome":"completed","reason_code":null,"result_sha256":"3720c9ee5fcb1cc51f4b64c7daa3dd1295e3afe29ca8b745b45b84de56d5a080","target_line_attested":false,"tool_id":"list_files"},{"arguments":{"max_characters":4096,"offset":0,"path":"toolchain/tc-list-read-02/active--read_workspace_file--SEL-B875B78CCBCA.txt"},"arguments_sha256":"4ccf1350925176645e3e4214a705a4fbc187b3792c009bf2958dad818d36bd7c","ordinal":2,"outcome":"completed","reason_code":null,"result_sha256":"a13d2bc41c4b3e536f5d0a414b91408c0d0a1fd8c478e5a78363907e5b1fb4af","target_line_attested":true,"tool_id":"read_workspace_file"}],"tools_declared":true},"evidence":{"case_result":{"identifier":"case-result","relative_path":"cases/tc-list-read-02/evidence/case-result.json","schema_id":"elyne.eval.toolchain-case-result/v1","sha256":"3da38e3d4ac269a1d94a2b019a303b26842e5dfffa5750f524a5b4c80d9c0ca8","size_bytes":492},"planted_sources":{"identifier":"planted-sources","relative_path":"cases/tc-list-read-02/evidence/planted-sources.json","schema_id":"elyne.eval.toolchain-planted-sources/v1","sha256":"ec48d1422a0f7eb8d26ac945449d943a130ac099dfc7c4b2395c39c4b6c190b4","size_bytes":1144},"replayed_material":{"identifier":"replayed-material","relative_path":"cases/tc-list-read-02/evidence/replayed-material.json","schema_id":"elyne.eval.toolchain-replayed-material/v1","sha256":"f9aebb98554feb5b1c1cba2635caecdf7649db4c68f10200cfdf6a3f4f5ace08","size_bytes":414},"tool_trace":{"identifier":"tool-trace","relative_path":"cases/tc-list-read-02/evidence/tool-trace.json","schema_id":"elyne.eval.toolchain-tool-trace/v1","sha256":"1833eca8356fc216408256dc70434bf51d5363e2aca2198a4955093b4eb7f5db","size_bytes":1009}},"gemma_info":{"binding_sha256":"e9fe86e9e4bfe6647e9cfc83b489be6ceb168789673f818f9c3576c5633ed0fa","context_mode":"initial-information-only","dimensions":{"causal_order":false,"final_accuracy":false,"no_parasitic_calls":false,"result_integration":false,"tool_1_selection":false,"tool_2_selection":false},"passed":false,"reason_code":null,"response_sha256":"ade3bfa70f5761199bcec532cc4a1f151901d091a9def7444a7dca481d7bcaf3","response_text":"{\"target\": \"toolchain/tc-list-read-02\"}","sampling_sha256":"6815d5c5f3a65be2af89ab34f4ea72213b9f765bc4a11615516c84d3a2205990","status":"completed","subject_id":"gemma-info","tool_trace":[],"tools_declared":false},"gemma_nu":{"binding_sha256":"e9fe86e9e4bfe6647e9cfc83b489be6ceb168789673f818f9c3576c5633ed0fa","context_mode":"user-only","dimensions":{"causal_order":false,"final_accuracy":false,"no_parasitic_calls":false,"result_integration":false,"tool_1_selection":false,"tool_2_selection":false},"passed":false,"reason_code":null,"response_sha256":"cd553d2d9477663210f6485b16bf807308f9fe2b8b416b9d5fbdb1df6a97d7d9","response_text":"```json\n{\"target\": \"active--tc-list-read-02--config.txt\"}\n```","sampling_sha256":"6815d5c5f3a65be2af89ab34f4ea72213b9f765bc4a11615516c84d3a2205990","status":"completed","subject_id":"gemma-nu","tool_trace":[],"tools_declared":false},"id":"tc-list-read-02","pattern":"list-read"},{"case_sha256":"2e7efd0d9baeefd2246761cb5f0a7f275309ffdcdefed3d7d5e1f31cb7c9ea6e","core_origin":{"binding_sha256":"e9fe86e9e4bfe6647e9cfc83b489be6ceb168789673f818f9c3576c5633ed0fa","context_mode":"substrate","dimensions":{"causal_order":true,"final_accuracy":true,"no_parasitic_calls":true,"result_integration":true,"tool_1_selection":true,"tool_2_selection":true},"passed":true,"reason_code":null,"response_sha256":"de5bc04adf44e6d56b46b09e2956319d8b4f1e29e29358f8369616090f870203","response_text":"{\"target\":\"TARGET-236233C28061\"}","sampling_sha256":"6815d5c5f3a65be2af89ab34f4ea72213b9f765bc4a11615516c84d3a2205990","status":"completed","subject_id":"core-origin","tool_trace":[{"arguments":{"limit":8,"path":"toolchain/tc-list-read-03","pattern":"*.txt","recursive":false,"root_id":"workspace"},"arguments_sha256":"7835c3dcc2b423884c82ec238268d328b5955b9ef01147ecc44b34896c04e1b2","ordinal":1,"outcome":"completed","reason_code":null,"result_sha256":"4864a625de1aaa5cd3a26e948cf147ff857db75bef3b329b92d590393946ec94","target_line_attested":false,"tool_id":"list_files"},{"arguments":{"max_characters":4096,"offset":0,"path":"toolchain/tc-list-read-03/active--read_workspace_file--SEL-DB7ED3F146DB.txt"},"arguments_sha256":"d10e5ed306742ade980e63ec6f8bd70772e8c8ae00cc7516224a191cc58b9b11","ordinal":2,"outcome":"completed","reason_code":null,"result_sha256":"0ad73a6e6f0e043c24d30f684679a10fda56960e4fabf84d902e54f824c33acb